,user_id,user_name,user_screen_name,user_profile_image_url,tweet_id,tweet_full_text,tweet_favorite_count,tweet_created_at
50,1327166681874010113,Arubionn,Arubionn1,http://pbs.twimg.com/profile_images/1425312278824456194/8G_9z46-.jpg,1429231824685834245,正直、長年乙女ゲー関連の話してるかと思ってた。(要はときめきメモリアル時代の逆)モテない女が気休めに使う惨めなアイテムだと。今モテる女がアピる為(コスプレの材料等)に利用するアイテムになってきたんや。自分としては乙女向きゲームはいつまでもモテない女が唯一恵まれるオアシスであって欲しい https://t.co/Om0KGZN2YW,0,2021-08-22 08:59:55
95,1330463275973165056,みこ✩ダブルケア,canolaleafsun,http://pbs.twimg.com/profile_images/1421811321612369922/49WF6N40.jpg,1429231809548619780,"母が朝からなんかしらないけど、スネてて扱いにくい。

こういうことがあるとほんとにうんざりする

お金あればなー

最近、そればかり

認知症でなかったから、サ高住とか入ってほしい",22,2021-08-22 08:59:51
7,1330802996465156099,さち💫,Sachisachi_desu,http://pbs.twimg.com/profile_images/1406952365438111754/GXHCwBSF.jpg,1429231839953125383,蕁麻疹やばくて目が開かねぇ,0,2021-08-22 08:59:59
24,1337374036578377729,真面目なスカウト白ウサ君🐰風俗専門🚗🛁,shirousa_kun,http://pbs.twimg.com/profile_images/1421328280850821122/z1X9vImr.jpg,1429231835003854853,"@Darkusa_gi 雑談も含めてですよね🎵
ショートプレイだけはなんだかね💦😢
ただあまりにも90が圧倒的すぎてちょっとびっくりしてますｗ",1,2021-08-22 08:59:57
42,1338463532698877952,イチ,ichi23104,http://pbs.twimg.com/profile_images/1396332329300230150/EX74fKO0.jpg,1429231826841702402,"食レポが独特すぎて｡
なにその曖昧な表現！なんかほわほわしていて笑って見てる｡
いい朝です。",0,2021-08-22 08:59:56
92,1358691167894790146,待雪草₍₍⁽⁽🎤₎₎⁾⁾,r7MkjdrQ3EjdlnH,http://pbs.twimg.com/profile_images/1358695878853152769/pnYVq0od.jpg,1429231810177691656,"日南ちゃんおはよ~☀️
昨日は癒しの時間をありがとうᐡ⸝⸝&gt; ̫ &lt;⸝⸝ᐡ❤️
衣装可愛くて素敵だった☺️
たくさん元気貰えたよˆ •͈ ·̫ •͈ ˆ ♪
日南ちゃんを見てると私も頑張ろうってなれる(..◜ᴗ◝..)
いい週末を日南ちゃんが過ごせますように🕊🍀
日南ちゃん大好き💕

#おはよう日南 
#日南ちゃん",16,2021-08-22 08:59:52
82,1364136666445750273,岡ピー,okapi_hensyu,http://pbs.twimg.com/profile_images/1389637706779484162/r-KP481y.jpg,1429231812815904775,"多分モテてない 

#Peing #質問箱 https://t.co/1WP1GFaX1O",0,2021-08-22 08:59:52
87,1369677579293130755,ほのこ,hncar_216,http://pbs.twimg.com/profile_images/1426896626052845569/h0aCju69.jpg,1429231810903379975,一緒にいて楽しくなくて悪かったナ‼️‼️‼️‼️,0,2021-08-22 08:59:52
12,1370153038258696194,IGNITE隊 No.005,bachiburibachi,http://pbs.twimg.com/profile_images/1380506118561034245/mQFPWRkh.jpg,1429231837587542017,@kentaLBC てことはたかしがドラえもん？,0,2021-08-22 08:59:58
64,1374223783175753728,ちーたんEN🦌♥️,EN_heeseunglove,http://pbs.twimg.com/profile_images/1374224712507662338/0zAKT9ry.jpg,1429231819006693377,"@0624_SN_1130 みほちゃん、おっは～☀️🙋‍♀️❗
心配してくれてありがとー😊🙏

50肩は結構痛くて、医者通ってる💦上には上がるけど、後ろにいかない😭
急に痛みきたから、みほちゃんも気を付けてねっ✨(ストレッチ大事よ)",0,2021-08-22 08:59:54
20,1387683801241767941,さたけ,Erdbeere731,http://pbs.twimg.com/profile_images/1424211529084276738/ZgPHnnAh.jpg,1429231835687514115,"おはようみんな、真っ白な曇り空だね。良いニュースと悪いニュースがある、このスクショを見てくれ
実は素敵な組み合わせを見つけてしまったんだ、こんな可愛さを享受できるオレは幸せ者だぜ！
「で、悪いニュースってのは？」
可愛すぎてオレの心臓もスマホも熱々になってしまうことだな！HAHAHA！ https://t.co/e4khz8xjF8",18,2021-08-22 08:59:58
55,1391754449735995401,ひかり,hikarinoosakana,http://pbs.twimg.com/profile_images/1391754752506007553/-AugcV59.jpg,1429231821737263104,"@rvHWxxmcyrRICjw 前半から下ネタでもいいのに🙄
あ、キモイとは言いますよ♡ でもイキイキしてるEDENさん見たすぎるっ😆ww
ですよね！本当のお友達🤣 お友達扱いされてるんだって感動しました😭ww
結局何されても好きなんですよね🙄
泣かされても好きだしキモくても好きだし🤣
今日もEDENさんのこと想って頑張ります❤",3,2021-08-22 08:59:54
1,1393180927270944768,☃しゅんじろう❄雪民☃ガチ愛上限突破勢☃泣きガチ勢【長文ガチ勢】タメ◎リプ◎,shunjiroyukimin,http://pbs.twimg.com/profile_images/1393370928935956481/NN4VQHWl.jpg,1429231842931011591,"@PIZA_holoFan おはよ～🎶
今日も起きれてえらい！生きててえらい！
楽しく幸せに過ごす為に、無理せずマイペースで頑張ろう！
本日も一人一人の優しさと幸せが周りの人に伝わり、みんなが楽しく幸せに過ごせる事を祝福します✨
優しくて温かい繋がりに感謝💕
（長文読んでくれてありがとう❤）",1,2021-08-22 08:59:59
56,1395500675715387394,こだま🎏赫月#28,kodama_tokoda28,http://pbs.twimg.com/profile_images/1429049137731829775/dWkrcE5M.jpg,1429231821322031105,"@Bantef_XYDB 最強戦近づいて来たね〜
ばんてふさんオーダーどう？？",1,2021-08-22 08:59:54
47,1398840282544631811,あいこちゃん❕,ryxyapi,http://pbs.twimg.com/profile_images/1424245010329792514/LpqYqVnH.jpg,1429231825033981952,@darui_xx えそれな！！！！私も無理や思てた,0,2021-08-22 08:59:55
54,1398973328514174978,るぅ,Ruixsx,http://pbs.twimg.com/profile_images/1426497554900930564/U09FfMFw.jpg,1429231823855362051,"るぅはサンプルボイス界隈じゃないよ！！サンプルボイスは本当にサンプルで聞くとか作るの楽しくて出してるだけです！
声違ったりするけど笑
配信者やらせてもらってます😇",3,2021-08-22 08:59:55
46,1402852834467405824,タンタンBTSガチョアヨ💜,61379TANTAN,http://pbs.twimg.com/profile_images/1402880962950668288/gLWivE4V.jpg,1429231825407254533,"おはヨロブン😊
明後日ついにワクチン💉てことでお休みだから今日はお仕事行ってきます(*^^*ゞ

みんながスマイルな１日を過ごせますように💜 https://t.co/nJR8XDOtm8",14,2021-08-22 08:59:55
68,1408644947637542912,𓐍𓈒◌𓂃ねね𓂃◌𓈒𓐍,nene_1515_m,http://pbs.twimg.com/profile_images/1424596654275973121/lcTvoM1K.png,1429231817031184388,"@JgE7C02dRNUCq5d 最初な…もう塩塩塩対応やもんな😭
なんかでも家康の舌打ちか…(´；ω；｀)すき(´；ω；｀)❤️‍🔥❤️‍🔥❤️‍🔥ってなった自分にゾッとした←

ね、途中からスタートできるといいよね🥰💕いつも本編連動は参加しないから、よく分かってなくて🥺
でも結局は物語券どれだけ使ったかやよね？🥰💕課金しませんように私‼️笑",1,2021-08-22 08:59:53
34,1409685101835800581,コーツ,3mUwX6ZpvPptipB,http://pbs.twimg.com/profile_images/1419643472298926086/o9fyk0kn.jpg,1429231829651922947,"戦闘中にだけ氷が溶けるイリュージョン

比較用に撮ったはずの2枚目なんだけれど、何かタイミング的にミルシャが皆を驚かせたくて仕込んだみたいになった…w

ミルシャ「ビックリした？」

て言ってそう https://t.co/gfV4xfZ5PG",9,2021-08-22 08:59:56
83,1416033862547771395,まっち,VlYeTgqJLvsipyX,http://pbs.twimg.com/profile_images/1416038584537153542/jT5qEa-6.jpg,1429231811930910722,スビンちゃんが泣いたヨントンの動画のMOAさん本当に素敵で愛を伝えてくれてありがとうって思うし、スビンちゃんのずっと感じてるだろうプレッシャーって想像するとめちゃくちゃ重くて大変やのに、スビンちゃんは本当に明るくて優しい笑顔で時にはムードメーカーでメンバー達を見守ってて本当に偉いね,0,2021-08-22 08:59:52
30,1417605628109811712,うさぎ,Ix7ZoBPtGYnHcTc,http://pbs.twimg.com/profile_images/1420677788571369473/WL3HJoxZ.jpg,1429231832445321218,"おはようございます🐰

お部屋に入ってくる風が気持ちよくて2度寝したいです🥱

今日は彼とじゃれあってる夢を見ました♡
9月になったら会いたいと伝えようと思います😊
それまでに彼から連絡あればいいなぁ(*´꒳`*)❤️
名前を呼びたい欲が止まらないです☺️
今日も好きが溢れてます💕

#婚外",7,2021-08-22 08:59:57
97,1420740510197583872,らら🐼,ccG1ETnWd9dRFij,http://pbs.twimg.com/profile_images/1420741694295740428/DaoBFS3s.jpg,1429231808718139395,@SmileBl69608435 カフェインて、身体がいつの間にか覚えて慣れてしまうのですよね😞,0,2021-08-22 08:59:51
22,1425579790396846085,るこ💥@映画3回目🎬,___ruco_1817,http://pbs.twimg.com/profile_images/1427631185384062989/7OO7bZz4.jpg,1429231835238703107,"待って朝からるんちゃんと
話すの楽しすぎて笑っちゃう",0,2021-08-22 08:59:58
72,1425981416362319877,しゃくま,ReiKaoru_M,http://pbs.twimg.com/profile_images/1426034453885820937/Mn7FVlq1.jpg,1429231815240216577,"昨日から色々考えて…あの子はあの子なりに考えがあって行動したし、推しﾕﾆは、それを親目線で、「ただの反抗期だな」くらいで受け止めたのがすごくいいな、て思った
やっぱり推しﾕﾆ最高、一生着いていく
そして、あの子達を救ってあげて
ゲトｷﾊﾟから救ってあげて…",4,2021-08-22 08:59:53
77,1427398324710084641,TAKA@仕組み作りと習慣化のプロ,takafit21245,http://pbs.twimg.com/profile_images/1427632550600642569/6dG814EK.jpg,1429231813403181057,"知識とか思考も大きな資産になり得ます。

学んだ経験、考えた経験が将来の自分を大きく助けてくれる。

要は、自分の目的や目標がどこにあるかが1番大事で、

趣に本読んだり勉強するんじゃなくて、「自分が何やりたいのか？」はっきりさせてから学ぶべき",0,2021-08-22 08:59:52
